{
  "data_fetch_bur": "2026-04-27",
  "ocena_dostawcy": 4.9,
  "liczba_ocen": 813,
  "liczba_uslug": 12,
  "url_bur_dostawca": "https://uslugirozwojowe.parp.gov.pl/wyszukiwarka/uslugi/szukaj?dostawcyUslug%5B%5D=160205&mozliwoscDofinansowania=0",
  "uslugi": [
    {
      "id_bur": "3432404",
      "tytul": "Nowoczesny Specjalista Social Media w Erze Cyfryzacji",
      "kategoria": "ai",
      "cena_brutto": 5900,
      "godziny": 20,
      "cena_h": 295,
      "forma": "zdalna",
      "miasto": null,
      "data_start": "2026-06-22",
      "data_end": "2026-06-24",
      "tier_priorytetu_irin": 1,
      "powiazane_priorytety": [
        "P3"
      ],
      "argumenty_sprzedazowe": [
        "Ocena 4.9/5 z 813 ocen w BUR",
        "Trafia w priorytet PARP P3: cyfryzacja i AI",
        "20h - krótka inwestycja czasowa",
        "Zdalna - elastyczność lokalizacji",
        "Dofinansowanie do 90% dla mikrofirm (KFS 2026)"
      ],
      "cena_h_rynek_avg": null,
      "cena_h_rynek_zrodlo": null
    },
    {
      "id_bur": "3432500",
      "tytul": "Nowoczesna sprzedaż w sklepie: cyfryzacja, marketing i bezpieczeństwo",
      "kategoria": "ai",
      "cena_brutto": 5900,
      "godziny": 20,
      "cena_h": 295,
      "forma": "zdalna",
      "miasto": null,
      "data_start": "2026-05-11",
      "data_end": "2026-05-13",
      "tier_priorytetu_irin": 1,
      "powiazane_priorytety": [
        "P3"
      ],
      "argumenty_sprzedazowe": [
        "Cyfryzacja handlu - priorytet PARP P3",
        "Praktyczne: marketing + bezpieczeństwo cyfrowe",
        "20h zdalne - minimum czasu poza firmą",
        "Dofinansowanie do 90% mikrofirmy"
      ],
      "cena_h_rynek_avg": null,
      "cena_h_rynek_zrodlo": null
    },
    {
      "id_bur": "3421591",
      "tytul": "Skuteczność osobista w erze cyfryzacji oraz wykorzystanie generatywnej AI w pracy",
      "kategoria": "ai",
      "cena_brutto": 5880,
      "godziny": 28,
      "cena_h": 210,
      "forma": "zdalna",
      "miasto": null,
      "data_start": "2026-07-13",
      "data_end": "2026-07-15",
      "tier_priorytetu_irin": 1,
      "powiazane_priorytety": [
        "P3"
      ],
      "argumenty_sprzedazowe": [
        "Łączy AI z efektywnością osobistą - 2 w 1",
        "Generatywne AI (ChatGPT, Claude, Midjourney) w praktyce",
        "28h za 5880 zł = 210 zł/h (poniżej rynkowej)",
        "Priorytet P3 PARP: cyfryzacja i AI"
      ],
      "cena_h_rynek_avg": null,
      "cena_h_rynek_zrodlo": null
    },
    {
      "id_bur": "3386476",
      "tytul": "Nowoczesna skuteczność w pracy: zarządzanie czasem, energią, motywacją i AI",
      "kategoria": "ai",
      "cena_brutto": 8750,
      "godziny": 50,
      "cena_h": 175,
      "forma": "zdalna",
      "miasto": null,
      "data_start": "2026-06-15",
      "data_end": "2026-06-19",
      "tier_priorytetu_irin": 1,
      "powiazane_priorytety": [
        "P3"
      ],
      "argumenty_sprzedazowe": [
        "50h intensywnego programu - kompleksowa transformacja",
        "175 zł/h - znacznie poniżej rynkowej (250+ zł/h)",
        "AI + zarządzanie sobą - kompetencje przyszłości",
        "Priorytet P3 PARP"
      ],
      "cena_h_rynek_avg": null,
      "cena_h_rynek_zrodlo": null
    },
    {
      "id_bur": "3420786",
      "tytul": "Integracja sensoryczna I+II - kurs z zakresu diagnozy i terapii (Gdańsk)",
      "kategoria": "edukacja",
      "cena_brutto": 9310,
      "godziny": 120,
      "cena_h": 77.6,
      "forma": "mieszana",
      "miasto": "Gdańsk",
      "data_start": "2026-05-22",
      "data_end": "2026-07-10",
      "tier_priorytetu_irin": 2,
      "powiazane_priorytety": [
        "P4"
      ],
      "argumenty_sprzedazowe": [
        "120h = kompletny program diagnostyczno-terapeutyczny",
        "77.6 zł/h - wyjątkowo niska cena dla specjalizacji medycznej",
        "Priorytet P4 PARP: sektor zdrowotny i opiekuńczy",
        "Gdańsk - oddział pomorski IRIN"
      ],
      "cena_h_rynek_avg": null,
      "cena_h_rynek_zrodlo": null
    },
    {
      "id_bur": "3405199",
      "tytul": "Integracja sensoryczna I+II (Gdańsk II termin)",
      "kategoria": "edukacja",
      "cena_brutto": 9310,
      "godziny": 120,
      "cena_h": 77.6,
      "forma": "mieszana",
      "miasto": "Gdańsk",
      "data_start": "2026-08-04",
      "data_end": "2026-09-20",
      "tier_priorytetu_irin": 2,
      "powiazane_priorytety": [
        "P4"
      ],
      "argumenty_sprzedazowe": [
        "Drugi termin Gdańsk - dla osób które nie zdążyły na maj",
        "Identyczny program: 120h, 77.6 zł/h"
      ],
      "cena_h_rynek_avg": null,
      "cena_h_rynek_zrodlo": null
    },
    {
      "id_bur": "3270238",
      "tytul": "Integracja sensoryczna I+II (Kielce)",
      "kategoria": "edukacja",
      "cena_brutto": 9310,
      "godziny": 120,
      "cena_h": 77.6,
      "forma": "mieszana",
      "miasto": "Kielce",
      "data_start": "2026-05-19",
      "data_end": "2026-07-12",
      "tier_priorytetu_irin": 2,
      "powiazane_priorytety": [
        "P4"
      ],
      "argumenty_sprzedazowe": [
        "Kielce - siedziba IRIN, stacjonarnie + online",
        "120h za 77.6 zł/h"
      ],
      "cena_h_rynek_avg": null,
      "cena_h_rynek_zrodlo": null
    },
    {
      "id_bur": "3379725",
      "tytul": "TUS - Trening Umiejętności Społecznych (z profilaktyką uzależnień cyfrowych)",
      "kategoria": "edukacja",
      "cena_brutto": 6000,
      "godziny": 50,
      "cena_h": 120,
      "forma": "mieszana",
      "miasto": "Kielce",
      "data_start": "2026-06-12",
      "data_end": "2026-06-21",
      "tier_priorytetu_irin": 2,
      "powiazane_priorytety": [
        "P4"
      ],
      "argumenty_sprzedazowe": [
        "TUS z elementem cyfrowym (profilaktyka uzależnień cyfrowych)",
        "Priorytet P4 PARP: sektor opiekuńczy",
        "120 zł/h - bardzo konkurencyjna cena",
        "Kielce: łatwy dojazd + stacjonarnie"
      ],
      "cena_h_rynek_avg": null,
      "cena_h_rynek_zrodlo": null
    },
    {
      "id_bur": "3381926",
      "tytul": "Skuteczne przygotowanie projektu dofinansowanego - od pomysłu do kompletnego wniosku",
      "kategoria": "biznes",
      "cena_brutto": 5300,
      "godziny": 27,
      "cena_h": 196.3,
      "forma": "zdalna",
      "miasto": null,
      "data_start": "2026-07-29",
      "data_end": "2026-07-31",
      "tier_priorytetu_irin": 3,
      "powiazane_priorytety": [
        "P1"
      ],
      "argumenty_sprzedazowe": [
        "META-SZKOLENIE: klient po nim często wraca po inne szkolenia IRIN",
        "Praktyczne: od pomysłu do kompletnego wniosku",
        "27h za 5300 zł = 196 zł/h",
        "Top of funnel - lead generation dla IRIN"
      ],
      "cena_h_rynek_avg": null,
      "cena_h_rynek_zrodlo": null
    }
  ],
  "podsumowanie_oferty": {
    "klastry": {
      "ai_cyfryzacja": {
        "szkolenia": [
          "3432404",
          "3432500",
          "3421591",
          "3386476"
        ],
        "opis": "4 szkolenia zdalne z AI/cyfryzacji - priorytet P3 PARP, 20-50h, 5880-8750 zł",
        "mocne": "Dobrze trafiają w trend i priorytet. Zdalne = skalowalne ogólnopolsko."
      },
      "edukacja_specjalistyczna": {
        "szkolenia": [
          "3420786",
          "3405199",
          "3270238",
          "3379725"
        ],
        "opis": "Integracja sensoryczna (3 lokalizacje) + TUS - priorytet P4 PARP, 50-120h, 6000-9310 zł",
        "mocne": "Premium niche, lojalny klient, bardzo niski koszt godzinowy (77-120 zł/h)"
      },
      "biznes_meta": {
        "szkolenia": [
          "3381926"
        ],
        "opis": "Przygotowanie projektu dofinansowanego - meta-szkolenie, lead gen",
        "mocne": "Generuje pipeline dla pozostałych usług IRIN"
      }
    },
    "kfs_2026_przewaga": "IRIN jest w BUR (ID 160205, ocena 4.9/5, 813 ocen). Od 1.01.2026 KAŻDY dostawca KFS musi być w BUR. Firmy szkoleniowe bez BUR wypadły z rynku KFS. To przewaga IRIN - argument nr 1 w każdej rozmowie sprzedażowej."
  }
}
